{
  "contract_version": 1,
  "output": "products/index.html",
  "sources": [
    "client/components/product/card/tac.html",
    "client/pages/products/tac.html"
  ],
  "mappings": [
    {
      "generated_start": 120,
      "generated_end": 143,
      "source": "client/pages/products/tac.html",
      "source_start": 8,
      "source_end": 25
    },
    {
      "generated_start": 143,
      "generated_end": 170,
      "source": "client/components/product/card/tac.html",
      "source_start": 0,
      "source_end": 27
    }
  ]
}
